{
 "schema": 1,
 "nanoscope": "0.5.0",
 "ref": "test-tiny-914f3afd/modern-7d52d0e7/seed-0",
 "model": "Modern",
 "step": 20,
 "steps": [
  5,
  10,
  20
 ],
 "prompt": "Once upon a time there was",
 "tokens": [
  {
   "id": 277,
   "text": "Once"
  },
  {
   "id": 273,
   "text": " upon"
  },
  {
   "id": 271,
   "text": " a"
  },
  {
   "id": 278,
   "text": " time"
  },
  {
   "id": 259,
   "text": " the"
  },
  {
   "id": 82,
   "text": "r"
  },
  {
   "id": 69,
   "text": "e"
  },
  {
   "id": 274,
   "text": " was"
  }
 ],
 "attention": [
  {
   "module": "blocks.0.attn",
   "layer": 0,
   "heads": 2,
   "weights": [
    [
     [
      1.0
     ],
     [
      0.6464,
      0.3536
     ],
     [
      0.3724,
      0.4428,
      0.1848
     ],
     [
      0.1071,
      0.312,
      0.4117,
      0.1693
     ],
     [
      0.0226,
      0.0814,
      0.4165,
      0.4045,
      0.0751
     ],
     [
      0.0184,
      0.012,
      0.004,
      0.0017,
      0.0066,
      0.9573
     ],
     [
      0.0122,
      0.0117,
      0.0063,
      0.0019,
      0.0067,
      0.5012,
      0.46
     ],
     [
      0.0206,
      0.0531,
      0.1253,
      0.1618,
      0.0574,
      0.001,
      0.001,
      0.5797
     ]
    ],
    [
     [
      1.0
     ],
     [
      0.6117,
      0.3883
     ],
     [
      0.3319,
      0.3313,
      0.3368
     ],
     [
      0.152,
      0.1447,
      0.2001,
      0.5032
     ],
     [
      0.1007,
      0.09,
      0.1449,
      0.2041,
      0.4602
     ],
     [
      0.0037,
      0.0046,
      0.0031,
      0.0024,
      0.0009,
      0.9853
     ],
     [
      0.002,
      0.0028,
      0.0023,
      0.0025,
      0.0007,
      0.4396,
      0.5501
     ],
     [
      0.1268,
      0.1337,
      0.1383,
      0.0584,
      0.1342,
      0.0011,
      0.0009,
      0.4066
     ]
    ]
   ]
  },
  {
   "module": "blocks.1.attn",
   "layer": 1,
   "heads": 2,
   "weights": [
    [
     [
      1.0
     ],
     [
      0.7805,
      0.2195
     ],
     [
      0.4079,
      0.3922,
      0.1998
     ],
     [
      0.1005,
      0.2565,
      0.3454,
      0.2976
     ],
     [
      0.0593,
      0.0473,
      0.1192,
      0.2883,
      0.4859
     ],
     [
      0.0114,
      0.0271,
      0.0368,
      0.0378,
      0.027,
      0.8599
     ],
     [
      0.0057,
      0.0082,
      0.0125,
      0.0179,
      0.0161,
      0.5179,
      0.4216
     ],
     [
      0.1179,
      0.218,
      0.272,
      0.2057,
      0.1688,
      0.0046,
      0.0065,
      0.0066
     ]
    ],
    [
     [
      1.0
     ],
     [
      0.4676,
      0.5324
     ],
     [
      0.2392,
      0.3528,
      0.408
     ],
     [
      0.1931,
      0.2166,
      0.2945,
      0.2957
     ],
     [
      0.2904,
      0.2226,
      0.1985,
      0.1719,
      0.1166
     ],
     [
      0.0038,
      0.0035,
      0.0029,
      0.0026,
      0.0027,
      0.9845
     ],
     [
      0.0024,
      0.0016,
      0.0013,
      0.0012,
      0.001,
      0.4255,
      0.5671
     ],
     [
      0.0297,
      0.068,
      0.15,
      0.1746,
      0.1765,
      0.0225,
      0.0485,
      0.3302
     ]
    ]
   ]
  }
 ],
 "lens": {
  "top_k": 3,
  "layers": [
   {
    "name": "embeddings",
    "positions": [
     {
      "top": [
       {
        "id": 277,
        "text": "Once",
        "p": 0.1454
       },
       {
        "id": 0,
        "text": "<eos>",
        "p": 0.113
       },
       {
        "id": 273,
        "text": " upon",
        "p": 0.0834
       }
      ],
      "next": {
       "id": 273,
       "text": " upon",
       "p": 0.0834,
       "rank": 3
      }
     },
     {
      "top": [
       {
        "id": 273,
        "text": " upon",
        "p": 0.1544
       },
       {
        "id": 271,
        "text": " a",
        "p": 0.0848
       },
       {
        "id": 277,
        "text": "Once",
        "p": 0.078
       }
      ],
      "next": {
       "id": 271,
       "text": " a",
       "p": 0.0848,
       "rank": 2
      }
     },
     {
      "top": [
       {
        "id": 271,
        "text": " a",
        "p": 0.1162
       },
       {
        "id": 273,
        "text": " upon",
        "p": 0.1045
       },
       {
        "id": 278,
        "text": " time",
        "p": 0.0824
       }
      ],
      "next": {
       "id": 278,
       "text": " time",
       "p": 0.0824,
       "rank": 3
      }
     },
     {
      "top": [
       {
        "id": 278,
        "text": " time",
        "p": 0.1101
       },
       {
        "id": 271,
        "text": " a",
        "p": 0.0781
       },
       {
        "id": 12,
        "text": ",",
        "p": 0.0735
       }
      ],
      "next": {
       "id": 259,
       "text": " the",
       "p": 0.0252,
       "rank": 5
      }
     },
     {
      "top": [
       {
        "id": 259,
        "text": " the",
        "p": 0.1022
       },
       {
        "id": 12,
        "text": ",",
        "p": 0.0697
       },
       {
        "id": 14,
        "text": ".",
        "p": 0.0599
       }
      ],
      "next": {
       "id": 82,
       "text": "r",
       "p": 0.0008,
       "rank": 69
      }
     },
     {
      "top": [
       {
        "id": 212,
        "text": "\u0017",
        "p": 0.0053
       },
       {
        "id": 198,
        "text": "\t",
        "p": 0.0052
       },
       {
        "id": 48,
        "text": "P",
        "p": 0.0051
       }
      ],
      "next": {
       "id": 69,
       "text": "e",
       "p": 0.0049,
       "rank": 7
      }
     },
     {
      "top": [
       {
        "id": 69,
        "text": "e",
        "p": 0.0052
       },
       {
        "id": 212,
        "text": "\u0017",
        "p": 0.0051
       },
       {
        "id": 198,
        "text": "\t",
        "p": 0.005
       }
      ],
      "next": {
       "id": 274,
       "text": " was",
       "p": 0.0,
       "rank": 293
      }
     },
     {
      "top": [
       {
        "id": 274,
        "text": " was",
        "p": 0.1182
       },
       {
        "id": 276,
        "text": " day",
        "p": 0.0933
       },
       {
        "id": 221,
        "text": " ",
        "p": 0.0881
       }
      ],
      "next": null
     }
    ]
   },
   {
    "name": "blocks.0",
    "positions": [
     {
      "top": [
       {
        "id": 273,
        "text": " upon",
        "p": 0.1206
       },
       {
        "id": 277,
        "text": "Once",
        "p": 0.0834
       },
       {
        "id": 271,
        "text": " a",
        "p": 0.0671
       }
      ],
      "next": {
       "id": 273,
       "text": " upon",
       "p": 0.1206,
       "rank": 1
      }
     },
     {
      "top": [
       {
        "id": 273,
        "text": " upon",
        "p": 0.1047
       },
       {
        "id": 271,
        "text": " a",
        "p": 0.0858
       },
       {
        "id": 278,
        "text": " time",
        "p": 0.0752
       }
      ],
      "next": {
       "id": 271,
       "text": " a",
       "p": 0.0858,
       "rank": 2
      }
     },
     {
      "top": [
       {
        "id": 278,
        "text": " time",
        "p": 0.0992
       },
       {
        "id": 271,
        "text": " a",
        "p": 0.0777
       },
       {
        "id": 12,
        "text": ",",
        "p": 0.0744
       }
      ],
      "next": {
       "id": 278,
       "text": " time",
       "p": 0.0992,
       "rank": 1
      }
     },
     {
      "top": [
       {
        "id": 12,
        "text": ",",
        "p": 0.1013
       },
       {
        "id": 278,
        "text": " time",
        "p": 0.0841
       },
       {
        "id": 271,
        "text": " a",
        "p": 0.0466
       }
      ],
      "next": {
       "id": 259,
       "text": " the",
       "p": 0.0392,
       "rank": 4
      }
     },
     {
      "top": [
       {
        "id": 259,
        "text": " the",
        "p": 0.0839
       },
       {
        "id": 14,
        "text": ".",
        "p": 0.0567
       },
       {
        "id": 12,
        "text": ",",
        "p": 0.0472
       }
      ],
      "next": {
       "id": 82,
       "text": "r",
       "p": 0.0012,
       "rank": 63
      }
     },
     {
      "top": [
       {
        "id": 199,
        "text": "\n",
        "p": 0.0052
       },
       {
        "id": 198,
        "text": "\t",
        "p": 0.0052
       },
       {
        "id": 246,
        "text": "\ufffd",
        "p": 0.005
       }
      ],
      "next": {
       "id": 69,
       "text": "e",
       "p": 0.0045,
       "rank": 17
      }
     },
     {
      "top": [
       {
        "id": 199,
        "text": "\n",
        "p": 0.0051
       },
       {
        "id": 246,
        "text": "\ufffd",
        "p": 0.0051
       },
       {
        "id": 198,
        "text": "\t",
        "p": 0.0051
       }
      ],
      "next": {
       "id": 274,
       "text": " was",
       "p": 0.0003,
       "rank": 287
      }
     },
     {
      "top": [
       {
        "id": 221,
        "text": " ",
        "p": 0.0508
       },
       {
        "id": 276,
        "text": " day",
        "p": 0.0481
       },
       {
        "id": 274,
        "text": " was",
        "p": 0.0306
       }
      ],
      "next": null
     }
    ]
   },
   {
    "name": "blocks.1",
    "positions": [
     {
      "top": [
       {
        "id": 273,
        "text": " upon",
        "p": 0.1423
       },
       {
        "id": 271,
        "text": " a",
        "p": 0.0955
       },
       {
        "id": 277,
        "text": "Once",
        "p": 0.0775
       }
      ],
      "next": {
       "id": 273,
       "text": " upon",
       "p": 0.1423,
       "rank": 1
      }
     },
     {
      "top": [
       {
        "id": 273,
        "text": " upon",
        "p": 0.1055
       },
       {
        "id": 271,
        "text": " a",
        "p": 0.1043
       },
       {
        "id": 278,
        "text": " time",